{"schema":"lockwood.cleanup-outcome-receipt/v1","receipt_id":"receipt:cleanup-0001","target_digest":"sha256:aaaaaaaaaaaaaaaaaaaaaaaaaaaaaaaaaaaaaaaaaaaaaaaaaaaaaaaaaaaaaaaa","action":"cleanup-delete","cleanup_plan_digest":"sha256:bbbbbbbbbbbbbbbbbbbbbbbbbbbbbbbbbbbbbbbbbbbbbbbbbbbbbbbbbbbbbbbb","policy_snapshot_digest":"sha256:dddddddddddddddddddddddddddddddddddddddddddddddddddddddddddddddd","hold_snapshot_digest":"sha256:ffffffffffffffffffffffffffffffffffffffffffffffffffffffffffffffff","handoff_digest":"sha256:9999999999999999999999999999999999999999999999999999999999999999","evaluation_time":"2026-09-17T12:30:00Z","authorization_authority":"governance.example","authorization_assertion_digest":"sha256:cccccccccccccccccccccccccccccccccccccccccccccccccccccccccccccccc","principal_reference":"amber:principal:cleanup-0001","authorization_decision":"authorized","hold_decision":"not-held","outcome":"eligibility-lost","postcondition":"not-checked","failure_code":"lease-lost-before-attempt"}
